{
  "id": "subnet-calculator",
  "name": "Subnet Calculator",
  "description": "Calculate IPv4 network and broadcast addresses, netmasks, host ranges and reverse DNS, split subnets by prefix or host count, merge CIDR lists and check address membership. Runs entirely in your browser.",
  "category": "Developer",
  "tags": ["cidr", "developer", "ipv4", "netmask", "network", "subnet", "subnetting"],
  "version": "1.0.0",
  "runtime": "browser",
  "privacy": {
    "execution": "local",
    "dataUploaded": false,
    "storage": "none"
  }
}
