{
  "id": "log-analyzer",
  "name": "Log Analyzer",
  "description": "Analyze server, application and structured logs in your browser. Get severity counts, a throughput timeline, grouped messages, top errors and exception types, and search a large log in a virtualized view. Nothing is uploaded.",
  "category": "Developer",
  "tags": ["analysis", "debugging", "log", "observability", "parser", "structured", "troubleshooting"],
  "version": "1.0.0",
  "runtime": "browser",
  "privacy": {
    "execution": "local",
    "dataUploaded": false,
    "storage": "none"
  }
}
