{
  "id": "file-checksum",
  "name": "File Checksum",
  "description": "Compute SHA-1, SHA-256, SHA-384 and MD5 checksums for any file, right in your browser.",
  "category": "Developer",
  "tags": ["checksum", "hash", "sha", "md5", "integrity", "developer"],
  "version": "1.0.0",
  "runtime": "browser",
  "privacy": {
    "execution": "local",
    "dataUploaded": false,
    "storage": "none"
  }
}