{
  "id": "markdown-workspace",
  "name": "Markdown Workspace",
  "description": "Write Markdown with a live, safely-rendered preview, an outline you can jump through, document statistics and a health check for common mistakes. Everything runs locally in your browser.",
  "category": "Text",
  "tags": ["markdown", "editor", "preview", "outline", "text", "writing"],
  "version": "1.0.0",
  "runtime": "browser",
  "privacy": {
    "execution": "local",
    "dataUploaded": false,
    "storage": "none"
  }
}
